{
  "$schema": "https://json-schema.org/draft/2020-12/schema",
  "$id": "https://example.invalid/rll/relation_graph.schema.json",
  "title": "RLL Relation Graph",
  "description": "Structural contract for claim-bounded relation graphs. This schema records candidate relations only and does not validate scientific claims.",
  "type": "object",
  "additionalProperties": true,
  "required": [
    "schema",
    "graph_id",
    "claim_id",
    "claim_allowed",
    "status",
    "boundary",
    "nodes",
    "edges",
    "next_gate"
  ],
  "properties": {
    "schema": {"const": "rll.relation_graph.v1"},
    "graph_id": {"type": "string", "minLength": 1},
    "claim_id": {"type": "string", "minLength": 1},
    "claim_allowed": {"const": false},
    "status": {
      "type": "string",
      "enum": [
        "RELATIONAL_PENDING",
        "RELATIONAL_TESTED",
        "RELATIONAL_CONVERGENCE_CANDIDATE",
        "RELATIONAL_CONVERGENCE_BLOCKED",
        "RELATIONAL_VALIDATED_REVIEW_READY",
        "RELATIONAL_REFUTED"
      ]
    },
    "boundary": {"type": "string", "minLength": 1},
    "nodes": {
      "type": "array",
      "minItems": 1,
      "items": {
        "type": "object",
        "additionalProperties": true,
        "required": ["id", "kind"],
        "properties": {
          "id": {"type": "string", "minLength": 1},
          "kind": {"type": "string", "minLength": 1}
        }
      }
    },
    "edges": {
      "type": "array",
      "minItems": 1,
      "items": {
        "type": "object",
        "additionalProperties": true,
        "required": ["from", "to", "edge_type"],
        "properties": {
          "from": {"type": "string", "minLength": 1},
          "to": {"type": "string", "minLength": 1},
          "edge_type": {"type": "string", "minLength": 1}
        }
      }
    },
    "next_gate": {"type": "string", "minLength": 1}
  }
}
